{"artifacts":{"linux-aarch64":{"archive_size":4096,"entrypoint":"bin/audioviz-vj","files_manifest_sha256":"dddddddddddddddddddddddddddddddddddddddddddddddddddddddddddddddd","sha256":"cccccccccccccccccccccccccccccccccccccccccccccccccccccccccccccccc","uncompressed_size":8192,"url":"https://releases.mcav.live/runtime/1.2.0/linux-aarch64.zip"},"linux-x86_64":{"archive_size":4096,"entrypoint":"bin/audioviz-vj","files_manifest_sha256":"bbbbbbbbbbbbbbbbbbbbbbbbbbbbbbbbbbbbbbbbbbbbbbbbbbbbbbbbbbbbbbbb","sha256":"aaaaaaaaaaaaaaaaaaaaaaaaaaaaaaaaaaaaaaaaaaaaaaaaaaaaaaaaaaaaaaaa","uncompressed_size":8192,"url":"https://releases.mcav.live/runtime/1.2.0/linux-x86_64.zip"},"windows-x86_64":{"archive_size":4096,"entrypoint":"bin/audioviz-vj.exe","files_manifest_sha256":"ffffffffffffffffffffffffffffffffffffffffffffffffffffffffffffffff","sha256":"eeeeeeeeeeeeeeeeeeeeeeeeeeeeeeeeeeeeeeeeeeeeeeeeeeeeeeeeeeeeeeee","uncompressed_size":8192,"url":"https://releases.mcav.live/runtime/1.2.0/windows-x86_64.zip"}},"expires_at":"2026-09-30T00:00:00Z","generation":1,"published_at":"2026-08-31T00:00:00Z","release_version":"1.2.0","runtime_api_max":1,"runtime_api_min":1,"schema_version":1,"signing_key_id":"test-only-2026"}
